{
  "localIdentifiers" : [ {
    "value" : "BID12345678",
    "key" : "manufacturerId"
  } ],
  "manufacturingInformation" : {
    "country" : "DEU",
    "sites" : [ {
      "siteId" : "BPNSP5KFOmKwPXHU",
      "function" : "production"
    } ],
    "productionDate" : "2025-09-26"
  },
  "globalAssetId" : "aC799196-3E4E-d0Ad-2d6F-e1130EfdF6Fc",
  "partTypeInformation" : {
    "partClassification" : [ {
      "standard" : "GIN 20510-21513",
      "description" : "Generic standard for classification of parts in the automotive industry.",
      "id" : "1004712"
    } ],
    "manufacturerPartId" : "123-0.740-3434-A",
    "customerPartId" : "PRT-12345",
    "nameAtManufacturer" : "Mirror left",
    "nameAtCustomer" : "side element A"
  }
}