{
  "localIdentifiers" : [ {
    "value" : "BID12345678",
    "key" : "manufacturerId"
  } ],
  "manufacturingInformation" : {
    "country" : "DEU",
    "sites" : [ {
      "siteId" : "BPNSHvs3K90tT6G3",
      "function" : "production"
    } ],
    "productionDate" : "2025-09-26"
  },
  "globalAssetId" : "0E9F78Ad-2F8E-Bb50-aEd6-B8bFCBC0AB22",
  "partTypeInformation" : {
    "partClassification" : [ {
      "standard" : "GIN 20510-21513",
      "description" : "Generic standard for classification of parts in the automotive industry.",
      "id" : "1004712"
    } ],
    "customerPartId" : "PRT-12345",
    "manufacturerPartId" : "123-0.740-3434-A",
    "nameAtManufacturer" : "Mirror left",
    "nameAtCustomer" : "side element A"
  }
}